[
  {
    "schemaVersion": 1,
    "id": "LS-LAD-001",
    "lifespanStage": "late_adulthood",
    "minAge": 65,
    "maxAge": 120,
    "ageUnit": "years",
    "domainType": "physical_motor",
    "domainSubType": "balance",
    "title": "Supported Balance and Sit-to-Stand",
    "goal": "Explore supported Balance and Sit-to-Stand at a comfortable, adaptable level.",
    "readiness": "Adult can stand and walk with or without assistive devices.",
    "steps": [
      "Place a stable chair against a wall beside a counter or other secure support.",
      "Explore gentle weight shifts or a supported narrow stance only if steady.",
      "Try a comfortable sit-to-stand using hands or assistance as needed; rest at any time."
    ],
    "completionCriteria": "Participant tries a supported balance or sit-to-stand movement with assistance as needed; no timed or unassisted threshold is required.",
    "safety": [
      "Ensure stable non-slip footwear and keep chair placed against a wall.",
      "Stop if dizziness occurs."
    ],
    "adaptations": [
      "Use shorter attempts, accessible materials or additional support.",
      "Adapt the activity to your language, interests, health and current ability; participation does not require unassisted performance."
    ],
    "benefits": "Offers adaptable practice with movement or everyday hand skills. Choose support and effort that feel comfortable.",
    "sources": [
      "nhs-strength",
      "who-activity-2020"
    ],
    "imageUrl": "assets/adulthood/late/LS-LAD-001-dynamic-balance-sit-to-stand-fall-prevention-routine.webp",
    "imageAlt": "AI-generated illustration: An older adult standing with arms outstretched, balancing steadily near a sturdy chair in a sunny living room.",
    "imagePrompt": "An older adult standing with arms outstretched, balancing steadily near a sturdy chair in a sunny living room.",
    "reps": "Optional planning example: 5 days per week; adapt or skip as needed.",
    "duration": "Up to 15 minutes per planned opportunity, with breaks or shorter attempts as needed.",
    "schedule": {
      "daysPerWeek": 5,
      "minutes": 15,
      "strenuous": false
    },
    "prerequisites": [
      "LS-LAD-006"
    ],
    "suggestedBefore": [
      "LS-LAD-005"
    ],
    "kind": "activity",
    "reviewStatus": "source-informed-not-clinically-validated",
    "reviewedAt": "2026-10-23",
    "complexity": 2
  },
  {
    "schemaVersion": 1,
    "id": "LS-LAD-002",
    "lifespanStage": "late_adulthood",
    "minAge": 65,
    "maxAge": 120,
    "ageUnit": "years",
    "domainType": "cognitive",
    "domainSubType": "cognitive",
    "title": "Autobiographical Legacy Writing & Life Review",
    "goal": "Explore autobiographical Legacy Writing & Life Review at a comfortable, adaptable level.",
    "readiness": "Adult reflects on life milestones, career achievements, and family heritage.",
    "steps": [
      "Dedicate regular uninterrupted time in a comfortable, well-lit study.",
      "Chronologically document major life decisions, turning points, friendships, and philosophical insights.",
      "Organize memories into themed chapters with accompanying photographs."
    ],
    "completionCriteria": "Participant records or shares a chosen memory in a suitable format; publication and chapter counts are optional.",
    "safety": [
      "Pace writing sessions to avoid eye strain or emotional overwhelm."
    ],
    "adaptations": [
      "Use shorter attempts, accessible materials or additional support.",
      "Adapt the activity to your language, interests, health and current ability; participation does not require unassisted performance."
    ],
    "benefits": "Offers practice with exploration, learning and problem solving at a personally suitable level.",
    "sources": [
      "nia-aging"
    ],
    "imageUrl": "assets/adulthood/late/LS-LAD-002-autobiographical-legacy-writing-life-review.webp",
    "imageAlt": "AI-generated illustration: An elderly writer looking thoughtfully while writing in a large notebook near a sunny window.",
    "imagePrompt": "An elderly writer looking thoughtfully while writing in a large notebook near a sunny window.",
    "reps": "Optional planning example: 2 days per week; adapt or skip as needed.",
    "duration": "Up to 45 minutes per planned opportunity, with breaks or shorter attempts as needed.",
    "schedule": {
      "daysPerWeek": 2,
      "minutes": 45,
      "strenuous": false
    },
    "prerequisites": [],
    "suggestedBefore": [],
    "kind": "activity",
    "reviewStatus": "source-informed-not-clinically-validated",
    "reviewedAt": "2026-10-23",
    "complexity": 1
  },
  {
    "schemaVersion": 1,
    "id": "LS-LAD-003",
    "lifespanStage": "late_adulthood",
    "minAge": 65,
    "maxAge": 120,
    "ageUnit": "years",
    "domainType": "language_comm",
    "domainSubType": "oral_history",
    "title": "Oral History Audio Archive Recording",
    "goal": "Explore oral History Audio Archive Recording at a comfortable, adaptable level.",
    "readiness": "Adult enjoys recounting stories and heritage memories.",
    "steps": [
      "Use audio recorder or smartphone voice memo app.",
      "Select a weekly thematic prompt ('First neighborhood', 'World events', 'Family traditions').",
      "Narrate freely for 15-20 minutes with vivid sensory details, emotional reflection, and lessons learned.",
      "Share digital archive file with family."
    ],
    "completionCriteria": "Participant records or tells a chosen memory and decides whether to keep it private or share it.",
    "safety": [
      "Keep sessions conversational and relaxed."
    ],
    "adaptations": [
      "Use shorter attempts, accessible materials or additional support.",
      "Adapt the activity to your language, interests, health and current ability; participation does not require unassisted performance."
    ],
    "benefits": "Offers practice with communication and listening using speech, signs, pictures or assistive tools as appropriate.",
    "sources": [
      "nia-aging",
      "cdc-connections"
    ],
    "imageUrl": "assets/adulthood/late/LS-LAD-003-oral-history-audio-archive-recording.webp",
    "imageAlt": "AI-generated illustration: An adult speaking warmly into a tabletop audio microphone recording memories with a family listener.",
    "imagePrompt": "An adult speaking warmly into a tabletop audio microphone recording memories with a family listener.",
    "reps": "Optional planning example: 1 days per week; adapt or skip as needed.",
    "duration": "Up to 25 minutes per planned opportunity, with breaks or shorter attempts as needed.",
    "schedule": {
      "daysPerWeek": 1,
      "minutes": 25,
      "strenuous": false
    },
    "prerequisites": [],
    "suggestedBefore": [],
    "kind": "activity",
    "reviewStatus": "source-informed-not-clinically-validated",
    "reviewedAt": "2026-10-23",
    "complexity": 1
  },
  {
    "schemaVersion": 1,
    "id": "LS-LAD-004",
    "lifespanStage": "late_adulthood",
    "minAge": 65,
    "maxAge": 120,
    "ageUnit": "years",
    "domainType": "social_emotional",
    "domainSubType": "integrity",
    "title": "Optional Reflection and Gratitude Circle",
    "goal": "Explore optional Reflection and Gratitude Circle at a comfortable, adaptable level.",
    "readiness": "Adult participates in community groups, faith gatherings, or peer circles.",
    "steps": [
      "Participate in a weekly community circle, faith group, book club, or telephone peer group.",
      "Share 2 sincere acknowledgments of gratitude and one reflection on a difficult life obstacle that yielded resilience.",
      "Practice mindfulness or meditation focusing on acceptance of life's full arc."
    ],
    "completionCriteria": "Participant joins or considers a voluntary conversation or reflection; peace or gratitude is not required.",
    "safety": [
      "Ensure group space is emotionally safe and respectful."
    ],
    "adaptations": [
      "Use shorter attempts, accessible materials or additional support.",
      "Adapt the activity to your language, interests, health and current ability; participation does not require unassisted performance."
    ],
    "benefits": "Offers voluntary practice with shared attention, connection and expressing preferences or feelings.",
    "sources": [
      "cdc-connections",
      "nia-aging"
    ],
    "imageUrl": "assets/adulthood/late/LS-LAD-004-ego-integrity-synthesis-gratitude-circle.webp",
    "imageAlt": "AI-generated illustration: A group of older adults seated in a sunny garden pavilion sharing conversation and smiling warmly together.",
    "imagePrompt": "A group of older adults seated in a sunny garden pavilion sharing conversation and smiling warmly together.",
    "reps": "Optional planning example: 1 days per week; adapt or skip as needed.",
    "duration": "Up to 35 minutes per planned opportunity, with breaks or shorter attempts as needed.",
    "schedule": {
      "daysPerWeek": 1,
      "minutes": 35,
      "strenuous": false
    },
    "prerequisites": [],
    "suggestedBefore": [],
    "kind": "activity",
    "reviewStatus": "source-informed-not-clinically-validated",
    "reviewedAt": "2026-10-23",
    "complexity": 1
  },
  {
    "schemaVersion": 1,
    "id": "LS-LAD-005",
    "lifespanStage": "late_adulthood",
    "minAge": 65,
    "maxAge": 120,
    "ageUnit": "years",
    "domainType": "physical_motor",
    "domainSubType": "gait_speed",
    "title": "Supported Walking Practice",
    "goal": "Explore supported Walking Practice at a comfortable, adaptable level.",
    "readiness": "Adult walks independently without falling.",
    "steps": [
      "Choose a clear level route with no obstacles, keeping usual walking aids.",
      "Walk a short comfortable distance with assistance if needed.",
      "Stop and rest before fatigue; practise talking or puzzles separately when balance is uncertain."
    ],